{
  "schemaVersion": 1,
  "id": "c99-standard-c",
  "title": "C99 Standard C Skill",
  "language": "c",
  "standard": "c99",
  "formatter": {
    "id": "clang-format",
    "config": "style/clang-format.yaml"
  },
  "commentTemplates": "templates/comment-templates.json",
  "rules": "rules/embedded-c-rules.md",
  "kit": {
    "id": "c-userstyle-kit",
    "version": "1.2.0",
    "root": "CodingKit/tools/c-userstyle-kit",
    "config": "examples/c-kit.json",
    "snippets": "examples/c-snippets.json",
    "quickTarget": "examples/verify-target.json"
  },
  "excludedDirectories": [
    "vendor",
    "third_party",
    "generated",
    "Drivers",
    "device",
    "build",
    "out",
    "dist",
    "CodingKit/tools/c-userstyle-kit"
  ]
}
